payment_id,monto,moneda,fecha,proposito,motivo,pagador_id,receptor_id
1,10000000.00,,2023-06-10,,Pago a funcionario del SII por información privilegiada,1,
2,12000000.00,,2023-06-15,,Pago a funcionario de la CMF para detener investigación,1,
3,10000000.00,,2023-06-10,,Pago a funcionario del SII por información privilegiada,1,
4,12000000.00,,2023-06-15,,Pago a funcionario de la CMF para detener investigación,1,
5,15000000.00,,2023-07-20,,Pago a funcionario de la PDI por información confidencial.,1,4
